{
  "schema_version": "1.0",
  "recovery_id": "recovery_000000000000000000000001",
  "plan_id": "plan_000000000000000000000001",
  "plan_digest": "sha256:0123456789abcdef0123456789abcdef0123456789abcdef0123456789abcdef",
  "recovered_at": "2026-09-22T12:05:00.000000Z",
  "results": [
    {
      "action_id": "act-001",
      "status": "succeeded"
    }
  ]
}
